Title,Text"why perfectionism is a hindrance? by maryam jan, medium","are you also a perfectionist like me? i always wanted to score best marks in academics, either win or not to take part in competitions. under too much pressure to be perfect, i was always an average student because instead of working hard, i kept brooding over the results and it has ceased me from participating in really good competitions. this all-or-nothing mentality also stopped me from writing for all these years as anything less than that was unacceptable to me. i knew i had to make a change. it wasnt an easy process, but i actively decided to find the solution. so, began to delve into several articles about perfectionism so that i can decide when to stop chasing for it. learning deeply about perfectionism is the only way to deal with it as we cannot ignore the positive outcome we get by pursuing perfection. in this article, we will try to focus on taking the good part and ignore the bad things about flawlessness because without the desire to be the best, one cannot achieve hisher full potential. its the obsession that creates the problem. we just have to know the limits! do you also have this weird tendency to chase perfection, even though deep down, you know its probably unattainable? why do we do this? lets unpack that a bit. essentially, striving for perfection originates from a positive desire to improve ourselves, our work, and the world around us. it encourages us to achieve great things and produce high-quality results. from an early age, we have been deluged with the images of apparently perfect lives' on social media, in movies and even in advertising. the flawless faces, immaculate homes and wildly successful careers mesmerize us and we tend to compare that with our own flawed condition. this constant comparison can fuel our desire to be perfect, or at least appear to be. nobody likes failing, right? sometimes the pursuit of perfection is driven by fear of making mistakes, being judged, or not measuring up to the societal expectations. we always think like, if i aim high enough, ill minimize the chances of making mistakes or failing. this fear can drive us to strive for flawlessness as a kind of defense mechanism, a way to shield ourselves from negative feedback. the problem begins when this pursuit of perfection becomes obsessive, leading to self-destructive behaviours. impossibly high standards lead to disappointment, anxiety, stress, exhaustion and frustration. furthermore, the fear for flawlessness, hinder us from taking risks and embracing new challenges. excess of anything is harmful. our society stresses on achievement, success and flawlessness. we are constantly subjected to the idealized representations of reality, from the doctored images in magazines to the meticulously curated perfection on social media, influencing our perceptions. these images create unrealistic expectations and contribute to a culture of comparison, fueling our desire to measure up to these often unattainable standards. the pressure to excel in academics, career, and even in personal life further reinforces this pursuit of perfection. many people have high standards and a strong sense of responsibility, which can lead them to strive for perfection in their endeavors. by meticulously planning and executing tasks, we may feel like we can manage outcomes and avoid unwanted surprises. they may feel a deep sense of satisfaction from doing things to the best of their ability. the ambitious nature pushes us to learn and grow. but sometimes, this drive can tip over into perfectionism, where we set impossibly high standards and become overly critical of ourselves. also, falling short of unrealistic expectations can negatively impact our self esteem. for some of us, perfectionism can be linked to seeking approval and validation. we believe that being perfect will earn us the love and acceptance we crave, we might become obsessed with achieving that ideal. its a way of trying to control how others perceive us, even though its often based on flawed assumptions. many people think of perfectionism as striving to be your best, but it is not about self-improvement; its about earning approval and acceptance. -brene brown the pursuit of perfection can actually be counterproductive. when were so focused on being perfect, we can become paralyzed by fear of making mistakes. we might procrastinate, avoid taking risks, or become overly stressed and anxious. ironically, this can hinder our progress and prevent us from achieving our goals. continuos hard work can often lead to exhaustion and burnout. celebrating our small wins and learning from mistakes enables us to shift our focus from perfection to progress. as alexander pope aptly said, to err is human, to forgive divine embrace imperfection and recognize that its a natural part of the human experience. it also helps to reframe our definition of success. instead of focusing solely on the outcome, we can appreciate the process and effort we put in. did we learn something new? did we overcome a challenge? those are valuable achievements, even if the end result wasnt ""perfect."" ultimately, striving for excellence is a good thing, but chasing perfection is a recipe for disappointment. by embracing imperfection and focusing on growth, we can free ourselves from unnecessary pressure and live more fulfilling lives. do comment if you liked the article and share your views on chasing perfection and excellence. thank you -- -- an aspiring writer help status about careers press blog privacy terms text to speech teams"
"hindsight is . americas history is splitting down the by george dillard bouncin and behavin blogs jan, medium","the spanish flu of killed as many as million people around the world, and then everybody forgot about it for a century. though the flu killed countless people and led to drasticinterventions closed schools, quarantines, mask mandates, canceled public events, and more it quickly disappeared from american public memory. why did americans forget such a momentous event? there seem to be several reasons why people chose to forget the spanish flu. they quicklytiredof the public health restrictions and rushed to get back to normal even if it meant they were risking a second outbreak of the disease. the pandemic coincided with the end of the first world war, and the dramatic events associated with the peace negotiations may have been more attention-getting than a wave of sickness. and people perhaps lacked ways to comprehend the flu even experts didnt reallyunderstandthe disease. as the spanish flu pandemic receded into the past, americans allowed it to fade from public memory. it was a hard event to tell stories about. there werent a lot of heroes to celebrate or stories to tell; some people lived and others died, and there wasnt much reason for either. for those who survived, it was a dark and fearful time, a trauma they preferred to -- -- we publish articles that make you think and humorous blogs. topics range from politics, social justice, lgbtq, mental health, family, writing, humor, and entertainment. politics, environment, education, history. followcontact me:https:george-dillard.com. my history substack:https:worldhistory.substack.com. help status about careers press blog privacy terms text to speech teams"
"this is not goodbye, just a change in direction by erica breen wellness jan, medium","for years, medium has been my space to share stories, insights, and lessons on wellness, resilience, and balance along with the many unexpected topics my journey as a freelance writer led me to explore. its been an incredible journey, and im so grateful for everyone whos read, commented, and connected along the way. but as my vision for this work has grown, ive realized i want something different.thats why im moving everything to substack. on substack, ill be writing about: evidence-based wellness tips and hacks travel-inspired strategies for balanced living personal reflections and actionable insights ill leave all my articles here on medium, but moving forward, ill be pouring all my energy into creating exclusive, high-value content on substack.its where my best work will live. if youve enjoyed my writing here, id love for you to join me on substack. you can subscribe for free to get weekly articles, tips, and behind-the-scenes insights or stick around for exclusive content when i move to a paid model. https:unchartedwellness.substack.com thank you for being part of this journey on medium. i cant wait to connect with you in this next chapter! -- -- join me on a journey towards holistic well-being, where fitness, travel, nutrition, self-care intertwine. visitericabreenwellness.com help status about careers press blog privacy terms text to speech teams"
"thus at the appointed time i will surely gather them to myself, some before and many more after, for i know my own. beloved, i know when each will come to me, i know every trial and tribulation. says - la el - medium","thus at the appointed time i will surely gather them to myself, some before and many more after, for i know my own. beloved, i know when each will come to me, i know every trial and tribulation. says the lord sourceexcerpt from:https:www.thevolumesoftruth.comhold_fast_and_do_not_waver -- -- preparing the way of the lord, yahushua is his name!thevolumesoftruth.com help status about careers press blog privacy terms text to speech teams"
"the silent enemy: why cancer is smarter than you think by saad elbekri, md jan, medium","imagine you're sitting in a doctor's office, feeling perfectly healthy, and then you hear the words: ""you have cancer."" it's shocking. every day, , people face this same unexpected reality. most people diagnosed with cancer say the same thing: ""i felt perfectly healthy."" they didn't realize cancer had been slowly growing inside them for a long time. i have some terrible news: you have a in chanceof getting cancer in your lifetime, and millions of your cells become cancerous every day. but wait before you panic; your immune system destroys most of these cells before they can cause harm. but here's the catch: it's far more complicated than it seems. even if abdominal cancer surgeries are some of the most challenging and exciting i've performed. and despite all our training and research doctors still don't fully understand cancer. cancer is both terrifying and fascinating to study. cancerous cells are brilliant and relentless, with one clear mission:replicate at all costs. cancer is a hidden enemy that escapes your body's defences and finds new ways to do so, making it one of medicine's biggest challenges. at its simplest, your cells have one job: they work and replicate, and when they can no longer perform their role, they die. depending on where they are in your body, they may or may not be replaced by younger, healthier cells. the real problem with cancer is that malfunctioning cells don't follow the rules. usually, these damaged cells would be flagged by your body's police force your immune system and removed. even more shocking, cancer cells find a way to: now, imagine immortal, malfunctioning cells multiplying at a crazy pace, completely unchecked by your body's defences. this buildup of dangerous cells forms what we call atumour. initially, these tumours grow locally, confined to one area. as the cancer cells pile up, they encourage each other to grow and replicate while evading the immune system. when the tumour becomes large enough, it invades nearby healthy tissues and causesregional growth. my colleagues and i can usually remove the tumour at this stage, even if it is challenging. still, that's precisely for situations i'm getting paid for, and i like it. but here's where it gets tricky: cancer cells have a unique ability they can take highways through your body to spread. this process is calledmetastasis. there are two main routes cancer cells can simultaneously use: at this point, treatment becomes more complicated. surgery becomes less relevant in the early phase of the treatment. usually, we try to eliminate metastasis with systemic treatments beforehand. thankfully, modern medicine has made incredible progress in treating advanced cancer. metastasis no longer means the end it just means the treatment needs more personalization. but the big question remains. damage occurs when the cell's dna is altered. cell dna acts as the user manual for how your cell works. when that manual is damaged, the cell develops dna mutations, which cause it to malfunction. there are two ways a cell can get damaged: purely genetic cancers are caused by inherited damage. it's like receiving an altered manual the moment you're born. cancers appear earlier in life because aggressive mutations are found and cause rapid accumulation of dna damage. sporadic cancers, on the other hand, are caused by acquired damage over time. cancers show up much later. bad habits usually cause this type of dna mutation. for example (to name a few): those are seen over long-term exposition, causing chronic inflammation and creating a sustained environment of oxidative stress, which continuously damages the cell's dna, causing mutation and, over time, cancer. usually, your immune system would step in, recognize the damaged cell, and remove it. but cancer cells are smarter than you think. the more damage a cell accumulates, the more its dna gets altered. cancer cells develop new ways to do whatever they want with each change. remember, this cancerous cell does not follow any rules anymore. it can now: it's like a snowball effect: as damage builds, cells become more challenging to control. and here is how they do it. cancer cells develop their unique characteristics, making them unstoppable by your body's defences: yes. thankfully, modern medicine has made incredible miracles. but there's an even better approach: the best way to fight cancer is to prevent it from happening in the first place. check what screening options are available where you live and take advantage of them. early detection and prevention willsaveyour life. cancer is complex, but prevention and early detection are lifesaving. even if you feel perfectly healthy, small steps like improving your lifestyle and staying up to date on screenings can make all the difference. your health is worth it. take the first step today because ""feeling healthy"" doesn't always mean you are. here is a link if you'd like to get a deeper dive into cancer's hallmarks: https:www.cell.comcellfulltexts-()-?_returnurlhttpsafflinkinghub.elsevier.comfretrievefpiifsfshowalldtrue take control of your health todayi simplify complex medical topics to help you make smarter lifestyle choices around movement, nutrition, sleep, and connection. have questions or thoughts? share them in the comments i'd love to hear from you! follow mefor more actionable health tips and transparent insights into preventive medicine. let's start a conversation and build healthier lives together. -- -- surgeon in training driven by preventative care. making health education simple. help status about careers press blog privacy terms text to speech teams"
"too cold in winter to feel like moving or working out? heres how to make workout a daily habit! by ao liu, ph.d., csm jan, medium","you may read this articlehereif you dont have a membership with medium. otherwise, please continue reading here to support me. if youve found this article entertaininghelpfulinspiring, please consider supporting me bybuying me a scoop of whey protein here. what i want to talk about today was inspired by a conversation i had a few days ago while working on-site at the office. i was chatting with a colleague about working out and fitness concepts, and that conversation sparked some thoughts that i wanted to share. ive been working with my current employer for almost three years, and i met this colleague during my first project here. im the project manager for our team, and shes a software engineer. she had been working on that project longer than i had and was more experienced in many technical areas. she is a distinctive person and has provided me with valuable feedback on project management. during my first year at the company, at a department party, she mentioned that she was doing yoga and had been practicing it for some time. that left me with the impression that shes passionate about yoga. a few days ago, when we were at a team lunch together, she asked me why i started writing about my fitness experience and understanding. i explained my philosophy of meeting the better you and introduced my concept offaap(fitness as a project). i also shared my motivation to share my thoughts -- -- tech projprod mgr (pm) with a phd. i have yoe in fitness. the ao fitness studio and ao technologies are where i share about fitness and tech respectively. help status about careers press blog privacy terms text to speech teams"
"learning to shut the fuck up sometimes (which is pretty rich coming from me) by dsantolla jan, medium","the most beautiful of all compensations for our miseries is the tenderness of our fellow creatures.jean-jacques rousseau in perpetual hindsight, i have been know to talk quite often and often times more than i really should. call it my fatal flaw, hubris, or aggressive adhd. any of those is fine. since many of you have reached out with personal stories or problems you happen to be going through, ive had to practice shutting the ole hole and actively listening. to quote sahil bloom, im a helper. cant help it. pun very much intended. ive recently moved into my grandmothers house. for reasons aforementioned in my last post (go read that shit), i was neglecting her and the home that will one day be mine, though i hope that day is a far off horizon that i never see. since getting sober, ive been hyper fixated on tending to her every need and getting my home improvement on. (tim allen should really sell his own tool belts) i sometimes even stress myself to near panic over minute details or making sure she is okay and comfortable. for context, she can walk, is of sound mind, and sassy as all hell (apple-tree). she does have macular degeneration which causes her eyes to fail her but other than that, shes just fine. she also eats damn near a pound of butter a day but hey, i used to love cocaine, so who am i to judge? ive come to realize, through my ambition to make everything perfect, im actually causing her to fret over my well being. sometimes, less is more. which brings me to the whole point of todays lil blog post. when someone comes to you with an issue or in distress, ask yourself this question to set things into perspective do they want to be helped, heard, or hugged? some people dont want the solution to their problem, even if you have it readily available. some people want you to just sit and listen to them vent, for however long it may be. some people just want to be held, to feel a physical anchor while their soul is adrift at sea. im trying to be better about realizing that myself. when the ones you care about come to you for support, and they will, try asking them that simple question. do you want to be helped, heard, or hugged? peace, dorian -- -- help status about careers press blog privacy terms text to speech teams"
"ai infrastructure investment surge: billion push risks overlooking human-centered innovations, but can it address humanitys most pressing needs? because who needs empathy when you have billions! by the journey jan, medium","reforms. every system, every environment, and everything around us requires change after a certain time. as they say, change is the only constant. but sometimes, we wonder how often the change is happening. the right balance of change and improvements can give you stability, but if its too much in a short amount of time, then its just chaos. we lose the whole purpose of change its impact. we are aspiring to be something, personally, professionally, or just in general. some people, like me, can only thrive if they have clear goals. i do not like to entertain an impulse-driven environment because then you just become an enabler, a consumer to the chaos noise. a lot has been happening around us, as always. just because you became aware of your surroundings now does not mean all the important things are happening now. as we move forward in time, we will see ai as part of us in every aspect of human life. you wont be able to avoid it. but then, we will be part of an environment where our humanized way of things will be judged, altered, or directed through non-empathetic ai. recently, trump announced a major boost for ai infrastructure in the united states, with private companies planning to invest up to billion over the next four years. a new venture, calledstargate, is being launched by openai, softbank, and oracle, according to sources familiar with the deal. leaders from these companies, including softbank ceo masayoshi son, openais sam altman, and oracle founder larry ellison, are expected to join trump at the white house to make the announcement. the partnership will begin with a billion investment and start its first project a data center in texas. the plan is to expand to other states over time. other investors are expected to join, though their identities have not yet been revealed. stargate aims to create cutting-edge infrastructure to support ai development in the u.s. while spokespeople for softbank and openai have not commented, this massive initiative signals a strong push to position the u.s. as a leader in ai technology. which means ai gets funded, and every crazy idea of ai can be a reality of our future. i appreciate the funding, but when you have the power to drive innovation and lack the core fundamentals of human life and the struggles of humankind, it feels like a disconnect. i wish they could have given a more detailed approach to the agenda and prioritized what ai innovations could have benefited the people most, like healthcare, education, or energy. some of the most crucial ai innovations that could significantly benefit humanity: first, youll need to install the required libraries: for this example, well use a dataset of medical images (you can use datasets likebreast cancer histopathologyorchest x-rayfrom kaggle). after training the model, you can evaluate it on new, unseen data (e.g., a test set of images): after training, you can save the model and use it for predictions: to make this ai system more impactful, consider expanding it by: follow for a cynical perspective on ai and the world, while navigating an ai career. the journey ai by jasmin bharadiya jasminbharadiya.medium.com -- -- we welcome you to a new world of ai in the simplest way possible. enjoy light-hearted and bite-sized ai articles. help status about careers press blog privacy terms text to speech teams"
"fld resurrection. the second coming. day . by nasar karim jan, medium","there are advantages to being on autopilot. i get out of bed when the alarm goes off, i deal with the pet, i check the coffee machine and make my coffee, it drips into my cup whilst i wash the dishes. its the same thing every single morning. i dont think, i just do it. by the time ive been awake for minutes, my systems have rebooted, and any fog has cleared. if id stopped to think this morning before throwing myself down the length of my bed to turn off my alarm, i might have felt hungry. hunger has so far surprised me with its absence. the milkshake maker i purchased for this fat loss journey hasnt been used to make a single meal replacement shake. instead i poured warm milk into it, added a teaspoon of chocolate powder, dropped in the whisk ball and shook the whole thing vigorously until it was smooth, with a head of foam. that was my daughters hot chocolate, i wake her up with a drink every morning. on the periphery of my awareness as i did all of this, hovered the desire to have one of my meal replacement shakes, and a spectre of worry that lack of fuel might trigger a headache and make it hard to hit my target at work. i was undecided, but they both left, like two people tired of waiting for a bus on a cold morning. -- -- bsc psychology. author of myshi moo and the frightening face. help status about careers press blog privacy terms text to speech teams"
