Title,Text"keto big mac smash burger: a fast food fix you can feel good about by sean christopher jan, medium","do you miss the juicy satisfaction of a big mac? craving that special sauce and all-american cheeseburger goodness? well, ditch the guilt and embrace the indulgence with this incredible keto big mac smash burger recipe! this recipe offers a delicious and satisfying alternative to the classic big mac, perfectly tailored for the keto lifestyle. here at a life fully alive (alifefullyalive.com), were passionate about creating delicious and nutritious meals that fit your dietary needs, and perfectly complement programs like natures ozempic. our goal? to show you how to achieve similar results to those medications, but through the power of real, wholesome food! and teaching people how to eat to easily lose pounds in less than a month when you follow seans program at www.alifefullyalive.com. this keto big mac smash burger is: so, ditch the drive-thru and get ready to experience the deliciousness of a big mac, keto-style! for the burgers: for the special sauce: for the assembly: in a small bowl, whisk together mayonnaise, dijon mustard, white vinegar, worcestershire sauce, onion powder, garlic powder, paprika, salt, and pepper. set aside. divide ground beef into two equal portions and form each into a loose ball. heat a cast iron skillet or griddle over medium-high heat. add a drizzle of cooking oil. when the pan is hot, gently press down on each burger patty with a spatula, creating a thin, smashed patty. season with sea salt and black pepper. cook the patties for minutes per side, or until desired doneness. while the burgers cook, lightly toast the hamburger buns in the skillet or griddle. spread special sauce on both sides of the toasted buns. layer with lettuce, onion, pickle slices, cheese, and the juicy keto big mac patty. devour and enjoy! tips: looking for more keto recipe inspiration? head over to a life fully alive (alifefullyalive.com) for a treasure trove of delicious and healthy keto meals! i hope you enjoy this delicious keto big mac smash burger recipe! let us know what you think in the comments below, and dont forget to visitalifefullyalive.comfor more healthy and inspiring recipes. -- -- i am insanely passionate about teaching people how to heal their own bodies through proper nutrition. ready to live fully alive? visitwww.alifefullyalive.com help status about careers press blog privacy terms text to speech teams"
"alcohol addiction: tips on how to stop the pain by dr. gabriella korosi stepping toward health (dancing elephants press sister publication) jan, medium","read this story for free here. this year about , deaths were caused by alcohol.in daysyesterday the number was ,. in one day , people died because of alcohol. alcohol has been around forever and will be around for a long time. some people are able to drink a glass occasionally for celebration and many people can not. those are the people who i see as an addiction nurse. people who suffer from trauma, and pain, got into the notion of covering the pain by drinking alcohol to numb the painful memories. i had seen people become addicted to alcohol as a child as they were given regular drinks by parents, aunts, abusers, and more. a devastating cycle. i believe everyone deserves a chance to get out of addiction. i believe addiction is not a choice. people can easily get lost in the path down on the addiction road and can find it very difficult to get out. many people drink socially feeling they need to do so to follow the societal norm. i am one of those people who does not follow the crowd when it comes to alcohol consumption. i have lost too many friends, family, and patients because of alcohol. it is simply not worth it for me. -- -- articles focusing on our health, mental health, public health and wellness. take each step toward wellness as a success. ""hi"" writer, author,publisher,creator of connections, spreading positivity. healthspiritualitypositivityjoycaringpublic healthnursing. building community. help status about careers press blog privacy terms text to speech teams"
"what does the rainwater taste like? by aleena huda readers club jan, medium","one evening, it showered outside. my mom grabbed a vessel to collect the rainwater. she ran to the terrace and placed it on the beam. the rain stopped within a few minutes. i eagerly went to take the vessel but ended in dismay. i thought half of the pot would have been filled. only of the pot has been filled. anyhow, i couldnt wait to taste it. i wondered why we hadnt considered tasting the rainwater all these years. i thought drinking rainwater would catch cold for me. i also believed that it would be tasteless or neutral. with all curiosity, i had a sip. wow it was as sweet as the filtered water that we drank every day. it isnt similar to that but possesses a unique taste. no water in the world tastes similar to rainwater. we install water purifiers at home to bring that taste. but, god has made it naturally without any water purifiers. his blessing has been instilled in the rainwater. i could drink only a very little as i had to share with my mom and aunt too. my aunt said that one of our neighbours cooks food only with rainwater. my curiosity spikes high to give it a try. -- -- readers club is a reader-centered publication that delivers valuable insights across diverse topics. with a seamless, rule-free submission process, writers can share content without delays, creating a dynamic space for genuine, impactful stories. if you want to see real happiness, be glad you found me. follow me for inspirational life lesson stories to make you happy. help status about careers press blog privacy terms text to speech teams"
"the power of anti-aging strategies: slow down aging naturally by deskhealth jan, medium","aging gracefully isnt a dreamits a commitment to taking care of your mind and body naturally. inthe power of anti-aging strategies: slow down aging naturally,we reveal how small, sustainable steps can make a big difference. are you eating the right foods for longevity? staying hydrated? protecting your skin from environmental damage? each of these small actions adds up, and our latest blog walks you through it all. heres what youll uncover: anti-aging superfoods that boost energy and protect skin health stress management techniques to keep your body and mind youthful the magic of hydration, proper sleep, and mindfulness in your daily life this guide is packed with practical tips, from incorporating antioxidant-rich foods to setting routines that promote better aging. whether youre just starting your wellness journey or looking to refine it, this blog is your go-to resource. dont let time dictate how you look and feel. take charge of the aging process naturally! dive into this empowering read and transform the way you age today. discover the full guide now:read more -- -- sharing simple health tips, effective fitness plans, and nutrition insights to inspire a healthier, happier, and stronger you every day. help status about careers press blog privacy terms text to speech teams"
"actually self realisation .a great life guide by knowledge provider. jan, medium","hello friends today raman maharshi is talking to two ladies who are parsi ladies who are serious devotees that after seeing them we should also have a question and should realize what is serious, i am here whose name is just gulbai adminson brother question but questions were being asked from raman maharshi but there was a common thread on the questions, he used to say repeatedly that we know that our real self, our soul, is beyond our eyes, but this is theoretical knowledge, i understand this in your conversation, but please help us in how to realize it practically, she is telling the brahmin that we dont talk in a romantic way, why not, for every person who is very serious, but listen carefully the meaning of listening to the knowledge is if you have already heard the talk of some bilaspur somewhere and suddenly you remember it, while listening to this talk then you are not paying attention to it, if you add it, if you are able to listen carefully and see something else, live peacefully with it, a small flower, a small sprout blooms, praman says self-realization is something that you have to go and buy from the market, it is not a new experience, it is already inside you, you have been thinking that the experience of self-realization is already inside you. now what kind of experience is there in our country? the experience of the hand, the experience of eating, the experience of talking to your child, that conversation experience is mixed within this experience, obscene things are very much it is important that this thought which i have not been able to -- -- ""i'm a wordsmith with a passion for storytelling. crafting tales that inspire and captivate. where imagination meets words."" help status about careers press blog privacy terms text to speech teams"
"ways on how to take care of your womans emotions by abu_noor jan, medium",". when she is venting, allow her to speak. it is healthy for her not to bottle things inside . touch her. rub her hand, hold her waist, kiss her. physical touch is a window to her emotions . when she is crying, dont leave the room. hug her, comfort her, whether she is crying because of you or of another issue . ask her how she is, how she slept, how her day has been. good morning, good night makes her feel cared for . when she is worked up over an issue that you dont find a big deal, dont tell her she is petty. this makes her feel understood . get to know more about the family planning methods she uses. some of them affect her hormones, her hormones affect her emotions . learn how she behaves during her menstrual cycle. some women get moody during that time of the month. study your queen . love on her publicly and privately. give her clarity that she is the only one, dont entertain other women. this will make her feel secure . understand when she cries tears of joy. it means alot to her when you touch her heart to the point of tears . when she doubts her beauty, remind her of her beautiful and sexy she is -- -- freedomfighter black tea ihrs member bsc. computer scientist ceo annor tech. abu zaria alumni help status about careers press blog privacy terms text to speech teams"
orthopedic surgeon in chennai - medicalseo - medium,"anorthopedic surgeonis a medical specialist focused on diagnosing, treating, and preventing conditions related to the musculoskeletal system, which includes bones, joints, muscles, ligaments, and tendons. they manage a wide range of conditions, from fractures and sports injuries to chronic disorders like arthritis and scoliosis. orthopedic surgeons use various treatments, including non-surgical approaches like physical therapy, medications, and injections, as well as surgical interventions such as joint replacements, spinal surgeries, or repairs of torn ligaments. they work with patients of all ages, addressing both acute injuries and long-term degenerative conditions. with advanced training, orthopedic surgeons are skilled in using modern techniques such as minimally invasive surgery, ensuring faster recovery times and less postoperative pain. their expertise plays a critical role in improving mobility and enhancing quality of life for their patients. -- -- help status about careers press blog privacy terms text to speech teams"
"self discipline. how to quit addictions, diet, etc. by edburyr jan, medium","how to quit addictions, diet, etc. self-discipline is the primary skills that help you avoid acting against your best interests. self-discipline can help you avoid overeating, overspending, smoking, unwanted body language, nail-biting, procrastination, laziness, and experiencing unwanted emotional responses like fear, negativity, or anger. all of these share commonalities and have overlapping solutions. if youve successfully addressed one self-sabotaging behavior, you can likely adapt your approach to tackle others. mindset is crucial in all cases. step : accepting that there is a problem. step : identify reasons for change.change is much easier if backed by good reasons. obviously, most people find it much easier to change their diet after a heart attack. if your reasons for change seem weak, it may mean that other improvements are more pressing. this is great to know, as it can alleviate guilt or stress. however, it may also mean that you are lying to yourself about how significant the reasons are or that you should research or consider better reasons. step :ask yourself why you dont behave as youd like. understanding why you engage in certain behaviors can help you mitigate or leverage your psychological quirks. for example, if you consistently eat every chocolate bar in a multipack, changing your shopping habits might be a solution. recognizing when you deceive yourself is crucial. experiment until you find an approach that works for you. determining why you act against your interests can be as simple as noting reasons when you act against your goals or consciously thinking about why you dont behave as youd like. many bad habits stem from insecurities or negative beliefs. where this is the case, youll often need to improve your mindset. one of the best ways to do this is to disprove them. do this by finding someone who has overcome similar obstacles in equally or even more challenging circumstances. witnessing others success can debunk limiting beliefs and motivate you. also, finding out what they did can help. the most common reason for self-sabotaging behavior is disregarding the long term to the extent that it becomes destructive. it can be challenging to make yourself care about something that is far off. visualizing your reasons can make long-term concepts seem less abstract. another tip is to measure; checking your health, for example, will indicate if you are on the right path. step : rules.establishing rules to handle situations where you typically act against your best interests makes you less likely to falter. for example, lets assume youre tackling overspending. youve made a prioritized list of things to buy and have a rule to stick to these priorities. however, you notice that when shopping, you often see something that isnt yet on your list and immediately buy it. a new rule that unless a purchase is essential, you cant buy anything youve added to your list for a full day should remind you before each time this occurs. if you use rules, you should review them whenever you break one, mainly to identify consistent trends. reviews create a mild annoyance, which can serve as a good disincentive. punishing yourself more than this is counterproductive; many people berate themselves to the extent that they become depressed. worse, in many cases, people have conditioned themselves to engage in the behavior they aim to avoid. they may turn to unhealthy eating, substance abuse, smoking, etc., when feeling depressed, perpetuating a destructive cycle. forgive yourself quickly if you break a rule, but understand that this does not permit you to break that rule again. if you commonly break the same rule in the same way, more drastic action may be necessary. this may involve avoiding the triggering situation entirely. alternatively, adjust other aspects of your plan to compensate for this. you could address the issue in smaller steps or strive to resist the compulsion incrementally. importantly, repeatedly breaking the same rule in the same way is a sign that you may need external help. avoid adding too many rules at once; introducing rules gradually helps make them manageable and memorable. when all the rules are in place, they should address the specific issue; be wary of too many exceptions. we recommend monthly reviews of unwanted behaviors you aim to change until you are confident they are solved for good. during reviews, assess your adherence to the rules, their effectiveness, and any needed adjustments. keeping your rules in place long after a behavioral change helps reinforce your progress and catch potential lapses early. ideally, schedule recurring reminders in a calendar app (like google calendar). eventually, you can remove these reminders, perhaps after a year since your last significant change or lapse. step : understand the issue you are addressing. most people can outline an adequate diet; the tricky part is having the mental strength to sustain it. your solution may be more difficult or punitive than necessary or have other health implications. were not suggesting that you shouldnt educate yourself about dieting; its just that the mental side matters more. some issues only manifest when you are in a poor mental state, such as becoming dangerous when angry or intoxicated. for such problems, practice is limited, and one slip-up can potentially have catastrophic consequences. one way to mitigate problems that seldom occur is to think about and, ideally, visualize the situation and its solution. reasoning, when you are rational, before entering a fraught state, can help. visualizing and setting rules can also be effective for other issues, but they are especially crucial if you have minimal chances to practice. still, visualization will not make solving these problems easy. if youve experienced issues before, for instance, its unrealistic to believe that you can maintain discipline while drunk. the best approach may be to avoid ever getting intoxicated. similarly, for some, avoiding anger altogether may be easier than controlling it once it arises. addressing inadvertent body language, like dieting, requires constant vigilance. suppose your body language communicates boredom. it is hard to focus mainly on your body language while also on the conversation. focus can be extremely draining, especially over extended periods, such as full days of meetings. merely avoiding boring people or meetings provides only a partial solution. a better approach may be to increase your engagement so that you no longer feel bored, perhaps via a challenge. in anticipation of a potentially dull conversation, you could work on personal development, such as improving your storytelling skills, finding polite ways to end conversations, or becoming a better listener. further tips concurrently addressing several self-sabotaging behaviors is generally unwise. willpower is finite and depletes throughout the day, replenishing during sleep. making many decisions or lacking sleep can make it much harder to implement willpower-related changes. for further insights on this topic and strategies to overcome similar problems, consider reading kelly mcgonigals excellent book,the willpower instinct. robyn youkilissthin from withinis another valuable resource, especially if dieting is your focus. thanks for reading. my book,optimizing life, can be read for freehere i also offer personal online improvement-related coaching for per hour. please email me atedburyrgmail.comto book or inquire about groups or in-person rates. please also contact me if you would like a print copy of my book. -- -- help status about careers press blog privacy terms text to speech teams"
"my dietetics internship story and learnings. by anganaa barman soultouch jan, medium","i still remember the first day of my internship as if it was yesterday. my heart beat with excitement and nervousness as i walked into the hospital, my white coat feeling, a new place, new people. the bustling corridors smelled faintly of antiseptics, and the hum of conversations between doctors and nurses echoed around me.i felt like an outsider stepping into a world i had only read about in textbooks. on june i joined dr. meera madam and her team at the hospital. maam was a very helpful and supportive guide i met at the hospital. she never failed to smile whenever she looked at any new trainee.i was so happy to meet her. i was posted at a hospital in south india, and i am from a northeast indian state,so language was a big barrierfor me during my consultation in the hospital. the patients were from south india especially, and i was not able to communicate with them properly. but my friends and my guide have helped me a lot during that time. the senior dietitian was very good. she always made sure that i understood the cases. she always asked me, anganaa, do you understand? one day, i found a patient in the surgery ward, and he was from uttar pradesh, india, a north indian state who is also -- -- building a community of soul-friends where hate gives way to love, anger gives way to peace, misery gives way to joy wounds give way to healing. a curious mind exploring- nutrition, health, longevity, holistic self-improvement, spirituality, mindset, life lessons, and books. help status about careers press blog privacy terms text to speech teams"
"self-care tips for nurture your life by vishwambhara gavshinde good vibes club jan, medium","we must care for our mind, body, emotional, spiritual, and social well-being. according to the world health organization, self-care is important because it can help promote health, prevent disease, and help people manage better with illness. it needs to something create a self-care plan, for you. customizing your self-care plan. self-care is important because it helps re-establish balance and avoid burnout. it is often the mechanism of recalibrating and getting in touch with our ability to play, have fun, relax, and connect. sabrina romanoff, psyd get enough sleep. create a bedtime routine and maintain a consistent sleep schedule. drink at least glasses of water and other fluids to keep your body working properly every day. avoid alcohol, soda, and sugary drinks. drink water before meals. regular exercise can improve your health and reduce the risk of diseases. doing some regular activity(hobby) for enjoyment in free time. hobbies can give you a sense of pride and purpose. notice positive moments as they happen and experience them. enjoy it as much as you can -- -- a publication to share stories promoting joy and positivity so we can live a life where every day is a good day. content writer freelancer - you can connect with me on linkedin athttps:www.linkedin.cominvishwambhara-gavshine help status about careers press blog privacy terms text to speech teams"
book review of the new me by gagan dhawan book recommendation by swati tanu medium,"one tree can be made into a million matchsticks. but only one matchstick can burn a million trees! this book is a part of the series the new me book set. it primarily focuses on health and fitness. but there are some chapters on karma, self-discipline, motivation, etc., which make it more interesting to read. the basic to intermediate level information is provided in the book to lead a healthy and happy life. it is definitely well-researched. the book presentation is gorgeous. right from the cover design to some really good quotes. there are some real-life examples mentioned too, which are inspiring. overall an informative read. you might like to check some journals here. medium.com -- -- author, book enthusiast and coder. sharing captivating reads and insightful reviews. instagram: tanunest help status about careers press blog privacy terms text to speech teams"
