Title,Text"the silent enemy: why cancer is smarter than you think by saad elbekri, md jan, medium","imagine you're sitting in a doctor's office, feeling perfectly healthy, and then you hear the words: ""you have cancer."" it's shocking. every day, , people face this same unexpected reality. most people diagnosed with cancer say the same thing: ""i felt perfectly healthy."" they didn't realize cancer had been slowly growing inside them for a long time. i have some terrible news: you have a in chanceof getting cancer in your lifetime, and millions of your cells become cancerous every day. but wait before you panic; your immune system destroys most of these cells before they can cause harm. but here's the catch: it's far more complicated than it seems. even if abdominal cancer surgeries are some of the most challenging and exciting i've performed. and despite all our training and research doctors still don't fully understand cancer. cancer is both terrifying and fascinating to study. cancerous cells are brilliant and relentless, with one clear mission:replicate at all costs. cancer is a hidden enemy that escapes your body's defences and finds new ways to do so, making it one of medicine's biggest challenges. at its simplest, your cells have one job: they work and replicate, and when they can no longer perform their role, they die. depending on where they are in your body, they may or may not be replaced by younger, healthier cells. the real problem with cancer is that malfunctioning cells don't follow the rules. usually, these damaged cells would be flagged by your body's police force your immune system and removed. even more shocking, cancer cells find a way to: now, imagine immortal, malfunctioning cells multiplying at a crazy pace, completely unchecked by your body's defences. this buildup of dangerous cells forms what we call atumour. initially, these tumours grow locally, confined to one area. as the cancer cells pile up, they encourage each other to grow and replicate while evading the immune system. when the tumour becomes large enough, it invades nearby healthy tissues and causesregional growth. my colleagues and i can usually remove the tumour at this stage, even if it is challenging. still, that's precisely for situations i'm getting paid for, and i like it. but here's where it gets tricky: cancer cells have a unique ability they can take highways through your body to spread. this process is calledmetastasis. there are two main routes cancer cells can simultaneously use: at this point, treatment becomes more complicated. surgery becomes less relevant in the early phase of the treatment. usually, we try to eliminate metastasis with systemic treatments beforehand. thankfully, modern medicine has made incredible progress in treating advanced cancer. metastasis no longer means the end it just means the treatment needs more personalization. but the big question remains. damage occurs when the cell's dna is altered. cell dna acts as the user manual for how your cell works. when that manual is damaged, the cell develops dna mutations, which cause it to malfunction. there are two ways a cell can get damaged: purely genetic cancers are caused by inherited damage. it's like receiving an altered manual the moment you're born. cancers appear earlier in life because aggressive mutations are found and cause rapid accumulation of dna damage. sporadic cancers, on the other hand, are caused by acquired damage over time. cancers show up much later. bad habits usually cause this type of dna mutation. for example (to name a few): those are seen over long-term exposition, causing chronic inflammation and creating a sustained environment of oxidative stress, which continuously damages the cell's dna, causing mutation and, over time, cancer. usually, your immune system would step in, recognize the damaged cell, and remove it. but cancer cells are smarter than you think. the more damage a cell accumulates, the more its dna gets altered. cancer cells develop new ways to do whatever they want with each change. remember, this cancerous cell does not follow any rules anymore. it can now: it's like a snowball effect: as damage builds, cells become more challenging to control. and here is how they do it. cancer cells develop their unique characteristics, making them unstoppable by your body's defences: yes. thankfully, modern medicine has made incredible miracles. but there's an even better approach: the best way to fight cancer is to prevent it from happening in the first place. check what screening options are available where you live and take advantage of them. early detection and prevention willsaveyour life. cancer is complex, but prevention and early detection are lifesaving. even if you feel perfectly healthy, small steps like improving your lifestyle and staying up to date on screenings can make all the difference. your health is worth it. take the first step today because ""feeling healthy"" doesn't always mean you are. here is a link if you'd like to get a deeper dive into cancer's hallmarks: https:www.cell.comcellfulltexts-()-?_returnurlhttpsafflinkinghub.elsevier.comfretrievefpiifsfshowalldtrue take control of your health todayi simplify complex medical topics to help you make smarter lifestyle choices around movement, nutrition, sleep, and connection. have questions or thoughts? share them in the comments i'd love to hear from you! follow mefor more actionable health tips and transparent insights into preventive medicine. let's start a conversation and build healthier lives together. -- -- surgeon in training driven by preventative care. making health education simple. help status about careers press blog privacy terms text to speech teams"
"too cold in winter to feel like moving or working out? heres how to make workout a daily habit! by ao liu, ph.d., csm jan, medium","you may read this articlehereif you dont have a membership with medium. otherwise, please continue reading here to support me. if youve found this article entertaininghelpfulinspiring, please consider supporting me bybuying me a scoop of whey protein here. what i want to talk about today was inspired by a conversation i had a few days ago while working on-site at the office. i was chatting with a colleague about working out and fitness concepts, and that conversation sparked some thoughts that i wanted to share. ive been working with my current employer for almost three years, and i met this colleague during my first project here. im the project manager for our team, and shes a software engineer. she had been working on that project longer than i had and was more experienced in many technical areas. she is a distinctive person and has provided me with valuable feedback on project management. during my first year at the company, at a department party, she mentioned that she was doing yoga and had been practicing it for some time. that left me with the impression that shes passionate about yoga. a few days ago, when we were at a team lunch together, she asked me why i started writing about my fitness experience and understanding. i explained my philosophy of meeting the better you and introduced my concept offaap(fitness as a project). i also shared my motivation to share my thoughts -- -- tech projprod mgr (pm) with a phd. i have yoe in fitness. the ao fitness studio and ao technologies are where i share about fitness and tech respectively. help status about careers press blog privacy terms text to speech teams"
"learning to shut the fuck up sometimes (which is pretty rich coming from me) by dsantolla jan, medium","the most beautiful of all compensations for our miseries is the tenderness of our fellow creatures.jean-jacques rousseau in perpetual hindsight, i have been know to talk quite often and often times more than i really should. call it my fatal flaw, hubris, or aggressive adhd. any of those is fine. since many of you have reached out with personal stories or problems you happen to be going through, ive had to practice shutting the ole hole and actively listening. to quote sahil bloom, im a helper. cant help it. pun very much intended. ive recently moved into my grandmothers house. for reasons aforementioned in my last post (go read that shit), i was neglecting her and the home that will one day be mine, though i hope that day is a far off horizon that i never see. since getting sober, ive been hyper fixated on tending to her every need and getting my home improvement on. (tim allen should really sell his own tool belts) i sometimes even stress myself to near panic over minute details or making sure she is okay and comfortable. for context, she can walk, is of sound mind, and sassy as all hell (apple-tree). she does have macular degeneration which causes her eyes to fail her but other than that, shes just fine. she also eats damn near a pound of butter a day but hey, i used to love cocaine, so who am i to judge? ive come to realize, through my ambition to make everything perfect, im actually causing her to fret over my well being. sometimes, less is more. which brings me to the whole point of todays lil blog post. when someone comes to you with an issue or in distress, ask yourself this question to set things into perspective do they want to be helped, heard, or hugged? some people dont want the solution to their problem, even if you have it readily available. some people want you to just sit and listen to them vent, for however long it may be. some people just want to be held, to feel a physical anchor while their soul is adrift at sea. im trying to be better about realizing that myself. when the ones you care about come to you for support, and they will, try asking them that simple question. do you want to be helped, heard, or hugged? peace, dorian -- -- help status about careers press blog privacy terms text to speech teams"
"ai infrastructure investment surge: billion push risks overlooking human-centered innovations, but can it address humanitys most pressing needs? because who needs empathy when you have billions! by the journey jan, medium","reforms. every system, every environment, and everything around us requires change after a certain time. as they say, change is the only constant. but sometimes, we wonder how often the change is happening. the right balance of change and improvements can give you stability, but if its too much in a short amount of time, then its just chaos. we lose the whole purpose of change its impact. we are aspiring to be something, personally, professionally, or just in general. some people, like me, can only thrive if they have clear goals. i do not like to entertain an impulse-driven environment because then you just become an enabler, a consumer to the chaos noise. a lot has been happening around us, as always. just because you became aware of your surroundings now does not mean all the important things are happening now. as we move forward in time, we will see ai as part of us in every aspect of human life. you wont be able to avoid it. but then, we will be part of an environment where our humanized way of things will be judged, altered, or directed through non-empathetic ai. recently, trump announced a major boost for ai infrastructure in the united states, with private companies planning to invest up to billion over the next four years. a new venture, calledstargate, is being launched by openai, softbank, and oracle, according to sources familiar with the deal. leaders from these companies, including softbank ceo masayoshi son, openais sam altman, and oracle founder larry ellison, are expected to join trump at the white house to make the announcement. the partnership will begin with a billion investment and start its first project a data center in texas. the plan is to expand to other states over time. other investors are expected to join, though their identities have not yet been revealed. stargate aims to create cutting-edge infrastructure to support ai development in the u.s. while spokespeople for softbank and openai have not commented, this massive initiative signals a strong push to position the u.s. as a leader in ai technology. which means ai gets funded, and every crazy idea of ai can be a reality of our future. i appreciate the funding, but when you have the power to drive innovation and lack the core fundamentals of human life and the struggles of humankind, it feels like a disconnect. i wish they could have given a more detailed approach to the agenda and prioritized what ai innovations could have benefited the people most, like healthcare, education, or energy. some of the most crucial ai innovations that could significantly benefit humanity: first, youll need to install the required libraries: for this example, well use a dataset of medical images (you can use datasets likebreast cancer histopathologyorchest x-rayfrom kaggle). after training the model, you can evaluate it on new, unseen data (e.g., a test set of images): after training, you can save the model and use it for predictions: to make this ai system more impactful, consider expanding it by: follow for a cynical perspective on ai and the world, while navigating an ai career. the journey ai by jasmin bharadiya jasminbharadiya.medium.com -- -- we welcome you to a new world of ai in the simplest way possible. enjoy light-hearted and bite-sized ai articles. help status about careers press blog privacy terms text to speech teams"
"fld resurrection. the second coming. day . by nasar karim jan, medium","there are advantages to being on autopilot. i get out of bed when the alarm goes off, i deal with the pet, i check the coffee machine and make my coffee, it drips into my cup whilst i wash the dishes. its the same thing every single morning. i dont think, i just do it. by the time ive been awake for minutes, my systems have rebooted, and any fog has cleared. if id stopped to think this morning before throwing myself down the length of my bed to turn off my alarm, i might have felt hungry. hunger has so far surprised me with its absence. the milkshake maker i purchased for this fat loss journey hasnt been used to make a single meal replacement shake. instead i poured warm milk into it, added a teaspoon of chocolate powder, dropped in the whisk ball and shook the whole thing vigorously until it was smooth, with a head of foam. that was my daughters hot chocolate, i wake her up with a drink every morning. on the periphery of my awareness as i did all of this, hovered the desire to have one of my meal replacement shakes, and a spectre of worry that lack of fuel might trigger a headache and make it hard to hit my target at work. i was undecided, but they both left, like two people tired of waiting for a bus on a cold morning. -- -- bsc psychology. author of myshi moo and the frightening face. help status about careers press blog privacy terms text to speech teams"
"become a livegood customer and affiliate today! by william frick jan, medium","are you ready to transform your health, save money, and create an income stream? livegood offers you the opportunity to enjoy premium products while unlocking the potential for financial freedom. heres why joining livegood is the smartest move youll make this year: as a livegood customer:access to premium products: enjoy cutting-edge health and wellness products designed to improve your life. from high-quality supplements to life-enhancing wellness items, livegood ensures youre getting the best for your body and mind. affordable prices:say goodbye to overpriced products. our mission is to provide high-quality goods at prices that make sense. improve your well-being:take charge of your health with products designed to energize, nourish, and support you every day. why become a livegood affiliate?unlimited earning potential: turn your passion for health and wellness into a lucrative income stream. earn commissions by sharing livegood with others. low start-up cost:for just ., you can get started as an affiliate this includes your first month of membership! after that, its only .month to maintain your membership. residual income:build a team, earn recurring commissions, and create a lasting passive income. flexible and fun:work from anywhere and set your own hours. its the perfect opportunity to create the life youve always wanted. when you join livegood, youre not just becoming a customer; youre stepping into a supportive community of health enthusiasts and business builders. as you improve your health, you can also help others do the same all while earning a rewarding income. dont wait!whether youre looking to feel better, live healthier, or create a thriving business, livegood has you covered. join today and take the first step toward a healthier, wealthier, and more fulfilling future. get started now! visit to learn more and sign up. lets livegood together! medium.com -- -- just a guy that believes in god and wants to share information about the bible. historical, spiritual, and all the questions i have and have been answered. help status about careers press blog privacy terms text to speech teams"
"what is ayahuasca? (and can it cure your depression?) by kathryn fincham science spectrum jan, medium","if youre like me then over the past few years youve seen a big influx on social media of people praising the benefits of a drug calledayahuasca. reports from people taking the drug vary widely- some people describe a beautiful, traditional experience that helped them gain self-awareness and powerful insight, while others describe three hours filled with vomiting, diarrhea, and hallucinations so vivid that users of lsd would be jealous. this article gives a basic overview of the traditional psychedelic tea, including what it actually contains, what it does to the body, whether it has potential as a therapeutic for mental health conditions, and whether its actually safe to consume. typically, when one talks about ayahuasca theyre actually referring to a tea made from two different plants. these plants are: -- -- science spectrum is here to guide you on your personal path to understanding the fascinating world of science, mathematics, and related topics. our goal is to make complex concepts accessible to everyone. we are happy to be a member of the medium boost family! kathryn is a final-year phd candidate in medicinal chemistry. she's based in melbourne, australia. help status about careers press blog privacy terms text to speech teams"
"unlock your dream body: habits to transform your body before next summer by ashley richmond better advice jan, medium","of people fail at weight loss. perhaps you can relate. you might lose some weight but gain it right back. its a terrible cycle to be caught in. the way out is to build a sustainable habit system that makes weight loss easy and automatic. heres your action plan: people eat to manage their emotions. whether theyre - stressed- angry- sad- overwhelmed they reach for junk food to solve the problem. food wont fix any of your problems. find healthier ways to manage your feelings. the more you walk, the more calories youll burn. walking k steps per day is a cheat code for fat loss. -- -- reflections and advice on self-improvement, personal and professional growth, and valuable life lessons. join our community of nearly , readers! ill show you how to leverage your daily habits to transform your health. free weekly habit-building newsletter:https:www.ashleyrichmond.netnewsletter help status about careers press blog privacy terms text to speech teams"
"the bird flu is not the new covid by aarav mike's medical news jan, medium","ongoing virus for decades has resulted in a spillover of different animals. according to thecdc, since , there have been human infections in countries; around have been fatal. since , theres been less than cases. in march , the us reported their first flu detection in dairy cows. this is michael and lets get into it. the cases of bird flu have been mostly from u.s. dairy and poultry workers. animals like dairy cattle, wild birds, poultry flocks, and different mammals, like cats and bears, have detected the flu. there has been no person-to-person spread and the public health risk is low; with only confirmed cases in the us. however, there was one person who recently died from the bird flu. on january , , the louisiana department of health announced that since december, theres been one patient who has been hospitalized from the bird flu. that patient was the first to die in the us. samples were taken from the patient and it turns out that the virus mutated after the infection. meaning it adapted to the individual and to infect them better. even before the patient's death, the us has: unless you have a housecat, theres nothing to worry about. if you do, please get tested. even though theres been no person-to-person virus transmission, it is better to be safe than sorry. take precautions like washing your hands and using hand sanitizer. as of right now, california has the most people with the virus which is people. its not a lot but you still need to be safe. this is michael hoping you learned something today, signing off. -- -- this is the page i will post medical news every weeks. help status about careers press blog privacy terms text to speech teams"
"not to hurry americans: only a thin line between the womens right to abortion and the right to murder. by evelina raven illumination jan, medium","abortion has always been a topic of heated debate in the united states and is still full of contention and emotion. on a fundamental level, it sets women's right to decide on their body against the moral area that deals with questions like, ""when does life start?"""" abortion is the right to conclude about one's own body even three times over, while, on the other hand, it is the right to morals and the legality of the act of abortion. critics, who tend to liken it to legalizing murder, may press their point about the disparity to characterize that provisional empowerment is the wrong method for managing the situation. the us history of abortion rights is characterized by significantly changing laws. the ruling, roe v. wade, that was in was the primary one that made women in the us have legal rights to abortion. privacy and bodily autonomy were mentioned in the case to signify these rights, which are the main foundation. this case, however, was not valid after it was changed in by dobbs v. jackson womens health organization, which said that the powers of the regulation of abortion laws -- -- we curate and disseminate outstanding articles from diverse domains and disciplines to create fusion and synergy. i am writing......... help status about careers press blog privacy terms text to speech teams"
